{
  "schema_version": 1,
  "id": "anthropic",
  "display_name": "Anthropic",
  "sources": [
    {
      "id": "catalog",
      "url": "https://docs.anthropic.com/en/api/messages",
      "purpose": "models",
      "notes": "旧目录登记入口；本次迁入不代表已重新验证。"
    },
    {
      "id": "claude-code-legacy",
      "url": "https://platform.claude.com/docs/en/about-claude/models/overview",
      "purpose": "discovery",
      "notes": "旧订阅目录的来源，可能只是 API 文档；不能证明订阅模型或价格。"
    },
    {
      "id": "pricing",
      "url": "https://platform.claude.com/docs/en/about-claude/pricing",
      "purpose": "pricing",
      "notes": "API 与 Claude Code 订阅分开；缓存读和缓存写不同，写入 TTL 也可能改变计费。"
    },
    {
      "id": "audit-pricing",
      "url": "https://platform.claude.com/docs/en/about-claude/pricing",
      "purpose": "billing",
      "notes": "2026-09-16 全量核对使用的官方来源；结论见本次 evidence。"
    },
    {
      "id": "audit-models",
      "url": "https://platform.claude.com/docs/en/models/overview",
      "purpose": "billing",
      "notes": "2026-09-16 全量核对使用的官方来源；结论见本次 evidence。"
    },
    {
      "id": "audit-plans",
      "url": "https://claude.com/pricing",
      "purpose": "billing",
      "notes": "2026-09-16 全量核对使用的官方来源；结论见本次 evidence。"
    },
    {
      "id": "audit-code-models",
      "url": "https://code.claude.com/docs/en/model-config",
      "purpose": "billing",
      "notes": "2026-09-16 全量核对使用的官方来源；结论见本次 evidence。"
    },
    {
      "id": "alignment-anthropic-pricing",
      "url": "https://platform.claude.com/docs/en/about-claude/pricing",
      "purpose": "pricing",
      "notes": "参考价对齐来源；同平台按量价。"
    },
    {
      "id": "completion-code-models",
      "url": "https://code.claude.com/docs/en/model-config",
      "purpose": "models",
      "notes": "2026-09-16 订阅模型补漏核对；见 subscription-completeness 证据。"
    },
    {
      "id": "completion-api-pricing",
      "url": "https://platform.claude.com/docs/en/about-claude/pricing",
      "purpose": "pricing",
      "notes": "2026-09-16 订阅模型补漏核对；见 subscription-completeness 证据。"
    },
    {
      "id": "protocol-messages",
      "url": "https://platform.claude.com/docs/en/api/overview",
      "purpose": "models",
      "notes": "2026-09-16 协议面专项核对；具体型号范围、产品身份和缺项见本地协议证据。"
    },
    {
      "id": "protocol-chat",
      "url": "https://platform.claude.com/docs/en/cli-sdks-libraries/libraries/openai-sdk",
      "purpose": "models",
      "notes": "2026-09-16 协议面专项核对；具体型号范围、产品身份和缺项见本地协议证据。"
    },
    {
      "id": "protocol-code",
      "url": "https://code.claude.com/docs/en/llm-gateway",
      "purpose": "models",
      "notes": "2026-09-16 协议面专项核对；具体型号范围、产品身份和缺项见本地协议证据。"
    },
    {
      "id": "reasoning-claude-code",
      "url": "https://code.claude.com/docs/en/model-config",
      "purpose": "models",
      "notes": "思考能力专项；来源小节、型号适用范围与缺项见本地证据。"
    },
    {
      "id": "reasoning-claude-effort",
      "url": "https://platform.claude.com/docs/en/build-with-claude/effort",
      "purpose": "models",
      "notes": "思考能力专项；来源小节、型号适用范围与缺项见本地证据。"
    },
    {
      "id": "reasoning-claude-overview",
      "url": "https://platform.claude.com/docs/en/build-with-claude/thinking",
      "purpose": "models",
      "notes": "思考能力专项；来源小节、型号适用范围与缺项见本地证据。"
    },
    {
      "id": "reasoning-claude-thinking",
      "url": "https://platform.claude.com/docs/en/build-with-claude/extended-thinking",
      "purpose": "models",
      "notes": "思考能力专项；来源小节、型号适用范围与缺项见本地证据。"
    },
    {
      "id": "context-claude-models",
      "url": "https://platform.claude.com/docs/en/models/overview",
      "purpose": "models",
      "notes": "上下文长度专项来源；位置、UTC 获取时间、整数 / 标称规格和缺项见本地 context 证据。"
    },
    {
      "id": "context-claude-code",
      "url": "https://code.claude.com/docs/en/model-config",
      "purpose": "models",
      "notes": "上下文长度专项来源；位置、UTC 获取时间、整数 / 标称规格和缺项见本地 context 证据。"
    },
    {
      "id": "repair-claude-fable-5-1",
      "url": "https://platform.claude.com/docs/en/models/fable-5-1/overview",
      "purpose": "models",
      "notes": "价格与名称兼容补漏；逐项结论见 2026-09-17-prices-and-names 证据。"
    },
    {
      "id": "repair-claude-fable-5",
      "url": "https://platform.claude.com/docs/en/models/fable-5/overview",
      "purpose": "models",
      "notes": "价格与名称兼容补漏；逐项结论见 2026-09-17-prices-and-names 证据。"
    },
    {
      "id": "repair-context",
      "url": "https://platform.claude.com/docs/en/build-with-claude/context-windows",
      "purpose": "models",
      "notes": "价格与名称兼容补漏；逐项结论见 2026-09-17-prices-and-names 证据。"
    },
    {
      "id": "repair-code-protocol",
      "url": "https://code.claude.com/docs/en/llm-gateway-protocol",
      "purpose": "models",
      "notes": "API formats 与订阅 OAuth 请求头；2026-09-17 Fable 独立协议复核。"
    },
    {
      "id": "r0923-opus-5-5",
      "url": "https://platform.claude.com/docs/en/models/opus-5-5/overview",
      "purpose": "models",
      "notes": "Opus 5.5 型号规格、价格、思考与可用性；2026-09-23 核对，见 claude-opus-5-5 证据。"
    },
    {
      "id": "r0923-models",
      "url": "https://platform.claude.com/docs/en/about-claude/models/overview",
      "purpose": "models",
      "notes": "当前型号比较表；2026-09-23 核对。"
    },
    {
      "id": "r0923-pricing",
      "url": "https://platform.claude.com/docs/en/about-claude/pricing",
      "purpose": "pricing",
      "notes": "Model pricing 表与缓存倍率脚注；2026-09-23 核对。"
    },
    {
      "id": "r0923-effort",
      "url": "https://platform.claude.com/docs/en/build-with-claude/effort",
      "purpose": "models",
      "notes": "effort 档位、默认值与 Opus 5.5 思考不可关闭；2026-09-23 核对。"
    },
    {
      "id": "r0923-openai-sdk",
      "url": "https://platform.claude.com/docs/en/cli-sdks-libraries/libraries/openai-sdk",
      "purpose": "models",
      "notes": "官方 Chat 兼容层；2026-09-23 核对。"
    },
    {
      "id": "r0923-code-models",
      "url": "https://code.claude.com/docs/en/model-config",
      "purpose": "models",
      "notes": "Claude Code 别名、默认型号、effort、思考与 1M 窗口；2026-09-23 核对。"
    },
    {
      "id": "r0923-code-protocol",
      "url": "https://code.claude.com/docs/en/llm-gateway-protocol",
      "purpose": "models",
      "notes": "Claude Code API formats 与请求头；2026-09-23 核对。"
    },
    {
      "id": "r1010-code-models",
      "url": "https://code.claude.com/docs/en/model-config.md",
      "purpose": "models",
      "notes": "Claude Code 别名解析、版本要求、effort、思考开关与 1M 上下文；2026-10-10 核对。"
    },
    {
      "id": "r1010-pricing",
      "url": "https://platform.claude.com/docs/en/about-claude/pricing.md",
      "purpose": "pricing",
      "notes": "Model pricing 表与缓存倍率脚注；2026-10-10 核对。"
    },
    {
      "id": "r1010-effort",
      "url": "https://platform.claude.com/docs/en/build-with-claude/effort.md",
      "purpose": "models",
      "notes": "Sonnet 5.5 / Haiku 5.5 API effort 档位与缺省，只作对照；2026-10-10 核对。"
    },
    {
      "id": "r1010-code-protocol",
      "url": "https://code.claude.com/docs/en/llm-gateway-protocol.md",
      "purpose": "models",
      "notes": "Claude Code API formats；2026-10-10 核对。"
    },
    {
      "id": "r1010-sonnet-5-5",
      "url": "https://platform.claude.com/docs/en/models/sonnet-5-5/overview.md",
      "purpose": "pricing",
      "notes": "Sonnet 5.5 型号页：请求名、价格、窗口与发布状态；2026-10-10 核对。"
    },
    {
      "id": "r1010-haiku-5-5",
      "url": "https://platform.claude.com/docs/en/models/haiku-5-5/overview.md",
      "purpose": "pricing",
      "notes": "Haiku 5.5 型号页：请求名、两档价格、窗口与发布状态；2026-10-10 核对。"
    },
    {
      "id": "current-code-models",
      "url": "https://code.claude.com/docs/en/model-config",
      "purpose": "models",
      "notes": "Claude Code 当前型号、别名、effort、思考开关与上下文条件；逐模型结论见 claude-code-current 证据。"
    },
    {
      "id": "current-code-pricing",
      "url": "https://platform.claude.com/docs/en/about-claude/pricing",
      "purpose": "pricing",
      "notes": "Claude Code 订阅参考价所用的同平台完整公开按量价表；不证明订阅可用性。"
    },
    {
      "id": "current-code-protocol",
      "url": "https://code.claude.com/docs/en/llm-gateway-protocol",
      "purpose": "models",
      "notes": "Claude Code 官方 Anthropic Messages 传输契约；不从按量 API 推导其他协议面。"
    }
  ],
  "notes": "官方入口与本次核对来源；逐模型、价格、套餐的确认结论见 verification 和 evidence。",
  "excluded_request_ids": [
    "claude-haiku-4-5-20251001"
  ]
}
