{
  "schema_version": 1,
  "id": "moonshot",
  "display_name": "Moonshot / Kimi",
  "sources": [
    {
      "id": "catalog",
      "url": "https://platform.kimi.com/docs/models",
      "purpose": "models",
      "notes": "旧目录登记入口；本次迁入不代表已重新验证。"
    },
    {
      "id": "pricing",
      "url": "https://platform.kimi.com/docs/pricing/chat",
      "purpose": "pricing",
      "notes": "开放平台和 Kimi Code 分开；短请求名、日期版本、订阅可用型号分别验证。"
    },
    {
      "id": "kimi-code",
      "url": "https://www.kimi.com/code/docs/en/kimi-code/models",
      "purpose": "subscription",
      "notes": "调查入口；可能需要从该页继续寻找本产品确切资料。"
    },
    {
      "id": "audit-pricing-md",
      "url": "https://platform.kimi.com/docs/pricing/chat.md",
      "purpose": "billing",
      "notes": "2026-09-16 全量核对使用的官方来源；结论见本次 evidence。"
    },
    {
      "id": "audit-models-md",
      "url": "https://platform.kimi.com/docs/models.md",
      "purpose": "billing",
      "notes": "2026-09-16 全量核对使用的官方来源；结论见本次 evidence。"
    },
    {
      "id": "audit-kimi-code",
      "url": "https://www.kimi.com/code/docs/en/kimi-code/models",
      "purpose": "billing",
      "notes": "2026-09-16 全量核对使用的官方来源；结论见本次 evidence。"
    },
    {
      "id": "audit-membership",
      "url": "https://www.kimi.com/code/docs/en/kimi-code/membership.html",
      "purpose": "billing",
      "notes": "2026-09-16 全量核对使用的官方来源；结论见本次 evidence。"
    },
    {
      "id": "alignment-moonshot-pricing-policy",
      "url": "https://platform.kimi.com/docs/pricing/chat.md",
      "purpose": "pricing",
      "notes": "参考价对齐来源；同平台按量价。"
    },
    {
      "id": "protocol-chat",
      "url": "https://platform.kimi.com/docs/api/chat",
      "purpose": "models",
      "notes": "2026-09-16 协议面专项核对；具体型号范围、产品身份和缺项见本地协议证据。"
    },
    {
      "id": "protocol-responses",
      "url": "https://platform.kimi.com/docs/api/responses",
      "purpose": "models",
      "notes": "2026-09-16 协议面专项核对；具体型号范围、产品身份和缺项见本地协议证据。"
    },
    {
      "id": "protocol-messages",
      "url": "https://platform.kimi.com/docs/api/messages",
      "purpose": "models",
      "notes": "2026-09-16 协议面专项核对；具体型号范围、产品身份和缺项见本地协议证据。"
    },
    {
      "id": "protocol-claude",
      "url": "https://platform.kimi.com/docs/guide/claude-code-kimi",
      "purpose": "models",
      "notes": "2026-09-16 协议面专项核对；具体型号范围、产品身份和缺项见本地协议证据。"
    },
    {
      "id": "protocol-coding",
      "url": "https://www.kimi.com/code/docs/en/kimi-code/models",
      "purpose": "models",
      "notes": "2026-09-16 协议面专项核对；具体型号范围、产品身份和缺项见本地协议证据。"
    },
    {
      "id": "reasoning-kimi-code",
      "url": "https://www.kimi.com/code/docs/en/kimi-code/models",
      "purpose": "models",
      "notes": "思考能力专项；来源小节、型号适用范围与缺项见本地证据。"
    },
    {
      "id": "reasoning-moonshot",
      "url": "https://platform.kimi.com/docs/api/chat.md",
      "purpose": "models",
      "notes": "思考能力专项；来源小节、型号适用范围与缺项见本地证据。"
    },
    {
      "id": "context-kimi-code",
      "url": "https://www.kimi.com/code/docs/en/kimi-code/models",
      "purpose": "models",
      "notes": "上下文长度专项来源；位置、UTC 获取时间、整数 / 标称规格和缺项见本地 context 证据。"
    },
    {
      "id": "context-kimi-k3",
      "url": "https://platform.kimi.com/docs/guide/kimi-k3-quickstart.md",
      "purpose": "models",
      "notes": "上下文长度专项来源；位置、UTC 获取时间、整数 / 标称规格和缺项见本地 context 证据。"
    },
    {
      "id": "context-kimi-k27",
      "url": "https://platform.kimi.com/docs/guide/kimi-k2-7-code-quickstart.md",
      "purpose": "models",
      "notes": "上下文长度专项来源；位置、UTC 获取时间、整数 / 标称规格和缺项见本地 context 证据。"
    },
    {
      "id": "audit-pricing-html",
      "url": "https://platform.kimi.com/docs/pricing/chat",
      "purpose": "pricing",
      "notes": "2026-10-24 官方资料核对；价格 HTML 内嵌 DocTable 保留完整币种、列名与数字。"
    },
    {
      "id": "audit-context-cache",
      "url": "https://platform.kimi.com/docs/guide/context-caching",
      "purpose": "billing",
      "notes": "2026-10-24 官方资料核对；价格 HTML 内嵌 DocTable 保留完整币种、列名与数字。"
    },
    {
      "id": "context-kimi-k31",
      "url": "https://platform.kimi.com/docs/guide/kimi-k3-1-pro-quickstart",
      "purpose": "models",
      "notes": "2026-10-24 官方资料核对；价格 HTML 内嵌 DocTable 保留完整币种、列名与数字。"
    },
    {
      "id": "refresh-code-models",
      "url": "https://www.kimi.com/code/docs/en/kimi-code/models",
      "purpose": "models",
      "notes": "编程工具模型核对；逐项结论及获取时间见 evidence/moonshot/2026-10-16-coding-models.json。"
    },
    {
      "id": "refresh-code-codex",
      "url": "https://www.kimi.com/code/docs/en/third-party-tools/codex.html",
      "purpose": "models",
      "notes": "编程工具模型核对；逐项结论及获取时间见 evidence/moonshot/2026-10-16-coding-models.json。"
    },
    {
      "id": "refresh-code-claude",
      "url": "https://www.kimi.com/code/docs/en/third-party-tools/claude-code.html",
      "purpose": "models",
      "notes": "编程工具模型核对；逐项结论及获取时间见 evidence/moonshot/2026-10-16-coding-models.json。"
    },
    {
      "id": "refresh-code-membership",
      "url": "https://www.kimi.com/code/docs/en/kimi-code/membership.html",
      "purpose": "subscription",
      "notes": "编程工具模型核对；逐项结论及获取时间见 evidence/moonshot/2026-10-16-coding-models.json。"
    },
    {
      "id": "refresh-kimi-pricing",
      "url": "https://platform.kimi.com/docs/pricing/chat.md",
      "purpose": "pricing",
      "notes": "编程工具模型核对；逐项结论及获取时间见 evidence/moonshot/2026-10-16-coding-models.json。"
    },
    {
      "id": "refresh-kimi-cache",
      "url": "https://platform.kimi.com/docs/guide/context-caching",
      "purpose": "billing",
      "notes": "编程工具模型核对；逐项结论及获取时间见 evidence/moonshot/2026-10-16-coding-models.json。"
    },
    {
      "id": "refresh-k3-guide",
      "url": "https://platform.kimi.com/docs/guide/kimi-k3-quickstart",
      "purpose": "models",
      "notes": "编程工具模型核对；逐项结论及获取时间见 evidence/moonshot/2026-10-16-coding-models.json。"
    }
  ],
  "notes": "官方入口与本次核对来源；逐模型、价格、套餐的确认结论见 verification 和 evidence。"
}
