{
  "schema_version": 1,
  "id": "qianfan",
  "display_name": "百度千帆",
  "sources": [
    {
      "id": "catalog",
      "url": "https://cloud.baidu.com/doc/qianfan/s/rmh4stp0j",
      "purpose": "models",
      "notes": "旧目录登记入口；本次迁入不代表已重新验证。"
    },
    {
      "id": "pricing",
      "url": "https://cloud.baidu.com/doc/qianfan-docs/s/Jm8r1826a",
      "purpose": "pricing",
      "notes": "同名第三方模型采用千帆自己的价目；核对模型服务版本、缓存及图视频计价。"
    },
    {
      "id": "audit-current-prices",
      "url": "https://cloud.baidu.com/doc/qianfan/s/wmh4sv6ya",
      "purpose": "billing",
      "notes": "2026-09-16 全量核对使用的官方来源；结论见本次 evidence。"
    },
    {
      "id": "audit-catalog",
      "url": "https://cloud.baidu.com/doc/qianfan/s/rmh4stp0j",
      "purpose": "billing",
      "notes": "2026-09-16 全量核对使用的官方来源；结论见本次 evidence。"
    },
    {
      "id": "alignment-qianfan-current-prices",
      "url": "https://cloud.baidu.com/doc/qianfan/s/wmh4sv6ya",
      "purpose": "pricing",
      "notes": "参考价对齐来源；同平台按量价。"
    },
    {
      "id": "protocol-chat",
      "url": "https://cloud.baidu.com/doc/qianfan/s/xmh4sttmy",
      "purpose": "models",
      "notes": "2026-09-16 协议面专项核对；具体型号范围、产品身份和缺项见本地协议证据。"
    },
    {
      "id": "protocol-messages",
      "url": "https://cloud.baidu.com/doc/qianfan-docs/s/6mh3e6gjp",
      "purpose": "models",
      "notes": "2026-09-16 协议面专项核对；具体型号范围、产品身份和缺项见本地协议证据。"
    },
    {
      "id": "protocol-responses",
      "url": "https://cloud.baidu.com/doc/qianfan-docs/s/4mi400l1m",
      "purpose": "models",
      "notes": "2026-09-16 协议面专项核对；具体型号范围、产品身份和缺项见本地协议证据。"
    },
    {
      "id": "context-qianfan-models",
      "url": "https://cloud.baidu.com/doc/qianfan/s/rmh4stp0j",
      "purpose": "models",
      "notes": "上下文长度专项来源；位置、UTC 获取时间、整数 / 标称规格和缺项见本地 context 证据。"
    },
    {
      "id": "audit-20261024-chat",
      "url": "https://cloud.baidu.com/doc/qianfan-api/s/3m7of64lb",
      "purpose": "models",
      "notes": "2026-10-24 核对来源；具体型号、产品与缺口见本轮证据。"
    },
    {
      "id": "audit-20261024-thinking",
      "url": "https://cloud.baidu.com/doc/qianfan-docs/s/Wm95lyynv",
      "purpose": "models",
      "notes": "2026-10-24 核对来源；具体型号、产品与缺口见本轮证据。"
    },
    {
      "id": "audit-20261024-retirement",
      "url": "https://cloud.baidu.com/doc/qianfan/s/zmh4stou3",
      "purpose": "models",
      "notes": "2026-10-24 核对来源；具体型号、产品与缺口见本轮证据。"
    },
    {
      "id": "audit-20261024-changelog",
      "url": "https://cloud.baidu.com/doc/qianfan/s/Kmh4stnjp",
      "purpose": "models",
      "notes": "2026-10-24 核对来源；具体型号、产品与缺口见本轮证据。"
    }
  ],
  "notes": "官方入口与本次核对来源；逐模型、价格、套餐的确认结论见 verification 和 evidence。"
}
