{
  "schema_version": 1,
  "id": "groq",
  "display_name": "Groq",
  "sources": [
    {
      "id": "catalog",
      "url": "https://console.groq.com/docs/openai",
      "purpose": "models",
      "notes": "旧目录登记入口；本次迁入不代表已重新验证。"
    },
    {
      "id": "pricing",
      "url": "https://groq.com/pricing",
      "purpose": "pricing",
      "notes": "保留 Groq 服务的请求名、计量项、服务等级；不能套相同开源模型在别处的价格。"
    },
    {
      "id": "audit-models",
      "url": "https://console.groq.com/docs/models",
      "purpose": "billing",
      "notes": "2026-09-16 全量核对使用的官方来源；结论见本次 evidence。"
    },
    {
      "id": "protocol-chat",
      "url": "https://console.groq.com/docs/openai",
      "purpose": "models",
      "notes": "2026-09-16 协议面专项核对；具体型号范围、产品身份和缺项见本地协议证据。"
    },
    {
      "id": "protocol-responses",
      "url": "https://console.groq.com/docs/responses-api",
      "purpose": "models",
      "notes": "2026-09-16 协议面专项核对；具体型号范围、产品身份和缺项见本地协议证据。"
    },
    {
      "id": "reasoning-groq",
      "url": "https://console.groq.com/docs/reasoning",
      "purpose": "models",
      "notes": "思考能力专项；来源小节、型号适用范围与缺项见本地证据。"
    },
    {
      "id": "reasoning-groq-responses",
      "url": "https://console.groq.com/docs/responses-api",
      "purpose": "models",
      "notes": "思考能力专项；来源小节、型号适用范围与缺项见本地证据。"
    },
    {
      "id": "context-groq-models",
      "url": "https://console.groq.com/docs/models",
      "purpose": "models",
      "notes": "上下文长度专项来源；位置、UTC 获取时间、整数 / 标称规格和缺项见本地 context 证据。"
    },
    {
      "id": "r1024-groq-models",
      "url": "https://console.groq.com/docs/models",
      "purpose": "models",
      "notes": "2026-10-24 模型、价格和能力核对；逐项结论见 evidence/groq/2026-10-24-refresh.md。"
    },
    {
      "id": "r1024-groq-deprecations",
      "url": "https://console.groq.com/docs/deprecations",
      "purpose": "models",
      "notes": "2026-10-24 模型、价格和能力核对；逐项结论见 evidence/groq/2026-10-24-refresh.md。"
    },
    {
      "id": "r1024-groq-caching",
      "url": "https://console.groq.com/docs/prompt-caching",
      "purpose": "pricing",
      "notes": "2026-10-24 模型、价格和能力核对；逐项结论见 evidence/groq/2026-10-24-refresh.md。"
    },
    {
      "id": "r1024-groq-chat",
      "url": "https://console.groq.com/docs/openai",
      "purpose": "models",
      "notes": "2026-10-24 模型、价格和能力核对；逐项结论见 evidence/groq/2026-10-24-refresh.md。"
    },
    {
      "id": "r1024-groq-responses",
      "url": "https://console.groq.com/docs/responses-api",
      "purpose": "models",
      "notes": "2026-10-24 模型、价格和能力核对；逐项结论见 evidence/groq/2026-10-24-refresh.md。"
    },
    {
      "id": "r1024-groq-reasoning",
      "url": "https://console.groq.com/docs/reasoning",
      "purpose": "models",
      "notes": "2026-10-24 模型、价格和能力核对；逐项结论见 evidence/groq/2026-10-24-refresh.md。"
    },
    {
      "id": "r1024-groq-qwen",
      "url": "https://console.groq.com/docs/model/qwen/qwen3.8-27b",
      "purpose": "models",
      "notes": "2026-10-24 模型、价格和能力核对；逐项结论见 evidence/groq/2026-10-24-refresh.md。"
    }
  ],
  "notes": "官方入口与本次核对来源；逐模型、价格、套餐的确认结论见 verification 和 evidence。",
  "excluded_request_ids": [
    "llama-3.3-70b-versatile"
  ]
}
