{
  "schema_version": 1,
  "id": "openrouter",
  "display_name": "OpenRouter",
  "sources": [
    {
      "id": "catalog",
      "url": "https://openrouter.ai/docs/quickstart",
      "purpose": "models",
      "notes": "旧目录登记入口；本次迁入不代表已重新验证。"
    },
    {
      "id": "pricing",
      "url": "https://openrouter.ai/api/v1/models",
      "purpose": "pricing",
      "notes": "聚合平台采用自己的模型和供应商路由报价；不能回退训练方价格，动态供应商差价需显式表达。"
    },
    {
      "id": "provider-routing",
      "url": "https://openrouter.ai/docs/guides/routing/provider-selection",
      "purpose": "models",
      "notes": "供应端选择与回退规则；用于判断模型价格适用范围。"
    },
    {
      "id": "endpoint-pricing",
      "url": "https://openrouter.ai/docs/api/api-reference/endpoints/list-all-endpoints-for-a-model",
      "purpose": "pricing",
      "notes": "按具体模型获取端点和独立价格；不全量导入。"
    },
    {
      "id": "audit-pricing",
      "url": "https://openrouter.ai/api/v1/models",
      "purpose": "billing",
      "notes": "2026-09-16 全量核对使用的官方来源；结论见本次 evidence。"
    },
    {
      "id": "protocol-chat",
      "url": "https://openrouter.ai/docs/quickstart",
      "purpose": "models",
      "notes": "2026-09-16 协议面专项核对；具体型号范围、产品身份和缺项见本地协议证据。"
    },
    {
      "id": "protocol-responses",
      "url": "https://openrouter.ai/docs/api_reference/responses/overview",
      "purpose": "models",
      "notes": "2026-09-16 协议面专项核对；具体型号范围、产品身份和缺项见本地协议证据。"
    },
    {
      "id": "protocol-messages",
      "url": "https://openrouter.ai/docs/api/api-reference/anthropic-messages/create-a-message.md",
      "purpose": "models",
      "notes": "2026-09-16 协议面专项核对；具体型号范围、产品身份和缺项见本地协议证据。"
    },
    {
      "id": "context-openrouter-models",
      "url": "https://openrouter.ai/api/v1/models",
      "purpose": "models",
      "notes": "上下文长度专项来源；位置、UTC 获取时间、整数 / 标称规格和缺项见本地 context 证据。"
    },
    {
      "id": "r1024-openrouter-models",
      "url": "https://openrouter.ai/api/v1/models",
      "purpose": "models",
      "notes": "2026-10-24 模型、价格和能力核对；逐项结论见 evidence/openrouter/2026-10-24-refresh.md。"
    },
    {
      "id": "r1024-openrouter-chat",
      "url": "https://openrouter.ai/docs/quickstart",
      "purpose": "models",
      "notes": "2026-10-24 模型、价格和能力核对；逐项结论见 evidence/openrouter/2026-10-24-refresh.md。"
    },
    {
      "id": "r1024-openrouter-responses",
      "url": "https://openrouter.ai/docs/api_reference/responses/overview",
      "purpose": "models",
      "notes": "2026-10-24 模型、价格和能力核对；逐项结论见 evidence/openrouter/2026-10-24-refresh.md。"
    },
    {
      "id": "r1024-openrouter-messages",
      "url": "https://openrouter.ai/docs/api/api-reference/anthropic-messages/create-a-message.md",
      "purpose": "models",
      "notes": "2026-10-24 模型、价格和能力核对；逐项结论见 evidence/openrouter/2026-10-24-refresh.md。"
    },
    {
      "id": "r1024-openrouter-reasoning",
      "url": "https://openrouter.ai/docs/guides/best-practices/reasoning-tokens",
      "purpose": "models",
      "notes": "2026-10-24 模型、价格和能力核对；逐项结论见 evidence/openrouter/2026-10-24-refresh.md。"
    }
  ],
  "notes": "官方入口与本次核对来源；逐模型、价格、套餐的确认结论见 verification 和 evidence。",
  "excluded_request_ids": [
    "~openai/gpt-latest"
  ]
}
