{
  "schema_version": 1,
  "id": "minimax",
  "display_name": "MiniMax",
  "sources": [
    {
      "id": "catalog",
      "url": "https://platform.minimaxi.com/docs/guides/models-intro",
      "purpose": "models",
      "notes": "旧目录登记入口；本次迁入不代表已重新验证。"
    },
    {
      "id": "pricing",
      "url": "https://platform.minimaxi.com/docs/guides/pricing-paygo",
      "purpose": "pricing",
      "notes": "国内与国际站独立记录；Token Plan 单独核对。文本、视频、图像和语音计量单位不同。"
    },
    {
      "id": "token-plan-cn",
      "url": "https://platform.minimaxi.com/docs/token-plan/intro",
      "purpose": "subscription",
      "notes": "调查入口；可能需要从该页继续寻找本产品确切资料。"
    },
    {
      "id": "pricing-current",
      "url": "https://platform.minimax.cn/docs/guides/pricing-paygo",
      "purpose": "pricing",
      "notes": "本轮核对视频、图像、TTS 计价，其他段未迁入。"
    },
    {
      "id": "speech-http",
      "url": "https://platform.minimax.cn/docs/api-reference/speech-t2a-http",
      "purpose": "billing",
      "notes": "同步 TTS usage_characters 字段。"
    },
    {
      "id": "audit-pricing",
      "url": "https://platform.minimaxi.com/docs/guides/pricing-paygo",
      "purpose": "billing",
      "notes": "2026-09-16 全量核对使用的官方来源；结论见本次 evidence。"
    },
    {
      "id": "audit-speech-http",
      "url": "https://platform.minimax.cn/docs/api-reference/speech-t2a-http",
      "purpose": "billing",
      "notes": "2026-09-16 全量核对使用的官方来源；结论见本次 evidence。"
    },
    {
      "id": "audit-token-plan-cn",
      "url": "https://platform.minimaxi.com/docs/token-plan/intro",
      "purpose": "billing",
      "notes": "2026-09-16 全量核对使用的官方来源；结论见本次 evidence。"
    },
    {
      "id": "alignment-minimax-pricing",
      "url": "https://platform.minimaxi.com/docs/guides/pricing-paygo",
      "purpose": "pricing",
      "notes": "参考价对齐来源；同平台按量价。"
    },
    {
      "id": "protocol-chat",
      "url": "https://platform.minimax.cn/docs/api-reference/text-openai-api",
      "purpose": "models",
      "notes": "2026-09-16 协议面专项核对；具体型号范围、产品身份和缺项见本地协议证据。"
    },
    {
      "id": "protocol-messages",
      "url": "https://platform.minimax.cn/docs/api-reference/text-anthropic-api",
      "purpose": "models",
      "notes": "2026-09-16 协议面专项核对；具体型号范围、产品身份和缺项见本地协议证据。"
    },
    {
      "id": "protocol-responses",
      "url": "https://platform.minimax.cn/docs/api-reference/responses-create",
      "purpose": "models",
      "notes": "2026-09-16 协议面专项核对；具体型号范围、产品身份和缺项见本地协议证据。"
    },
    {
      "id": "protocol-native",
      "url": "https://platform.minimax.cn/docs/api-reference/text-post",
      "purpose": "models",
      "notes": "2026-09-16 协议面专项核对；具体型号范围、产品身份和缺项见本地协议证据。"
    },
    {
      "id": "protocol-image",
      "url": "https://platform.minimax.cn/docs/api-reference/image-generation-t2i",
      "purpose": "models",
      "notes": "2026-09-16 协议面专项核对；具体型号范围、产品身份和缺项见本地协议证据。"
    },
    {
      "id": "protocol-video",
      "url": "https://platform.minimax.cn/docs/api-reference/video-generation-v2-create",
      "purpose": "models",
      "notes": "2026-09-16 协议面专项核对；具体型号范围、产品身份和缺项见本地协议证据。"
    },
    {
      "id": "protocol-speech",
      "url": "https://platform.minimax.cn/docs/api-reference/speech-t2a-http",
      "purpose": "models",
      "notes": "2026-09-16 协议面专项核对；具体型号范围、产品身份和缺项见本地协议证据。"
    },
    {
      "id": "protocol-plan",
      "url": "https://platform.minimax.cn/docs/token-plan/quickstart",
      "purpose": "models",
      "notes": "2026-09-16 协议面专项核对；具体型号范围、产品身份和缺项见本地协议证据。"
    },
    {
      "id": "protocol-codex",
      "url": "https://platform.minimax.cn/docs/token-plan/codex",
      "purpose": "models",
      "notes": "2026-09-16 协议面专项核对；具体型号范围、产品身份和缺项见本地协议证据。"
    },
    {
      "id": "protocol-cursor",
      "url": "https://platform.minimax.cn/docs/token-plan/cursor",
      "purpose": "models",
      "notes": "2026-09-16 协议面专项核对；具体型号范围、产品身份和缺项见本地协议证据。"
    },
    {
      "id": "reasoning-minimax",
      "url": "https://platform.minimax.cn/docs/api-reference/responses-create",
      "purpose": "models",
      "notes": "思考能力专项；来源小节、型号适用范围与缺项见本地证据。"
    },
    {
      "id": "reasoning-minimax-chat",
      "url": "https://platform.minimax.cn/docs/api-reference/text-openai-api",
      "purpose": "models",
      "notes": "思考能力专项；来源小节、型号适用范围与缺项见本地证据。"
    },
    {
      "id": "reasoning-minimax-messages",
      "url": "https://platform.minimax.cn/docs/api-reference/text-anthropic-api",
      "purpose": "models",
      "notes": "思考能力专项；来源小节、型号适用范围与缺项见本地证据。"
    },
    {
      "id": "context-minimax-text",
      "url": "https://platform.minimax.cn/docs/guides/text-generation",
      "purpose": "models",
      "notes": "上下文长度专项来源；位置、UTC 获取时间、整数 / 标称规格和缺项见本地 context 证据。"
    },
    {
      "id": "context-minimax-plan-selling",
      "url": "https://platform.minimax.cn/subscribe/token-plan",
      "purpose": "models",
      "notes": "上下文长度专项来源；位置、UTC 获取时间、整数 / 标称规格和缺项见本地 context 证据。"
    },
    {
      "id": "context-minimax-plan-intro",
      "url": "https://platform.minimaxi.com/docs/token-plan/intro.md",
      "purpose": "models",
      "notes": "上下文长度专项来源；位置、UTC 获取时间、整数 / 标称规格和缺项见本地 context 证据。"
    },
    {
      "id": "context-minimax-plan-faq",
      "url": "https://platform.minimax.cn/docs/token-plan/faq",
      "purpose": "models",
      "notes": "上下文长度专项来源；位置、UTC 获取时间、整数 / 标称规格和缺项见本地 context 证据。"
    },
    {
      "id": "context-minimax-models",
      "url": "https://platform.minimax.cn/docs/guides/models-intro",
      "purpose": "models",
      "notes": "上下文长度专项来源；位置、UTC 获取时间、整数 / 标称规格和缺项见本地 context 证据。"
    },
    {
      "id": "audit-pricing-overview",
      "url": "https://platform.minimax.cn/docs/pricing/overview",
      "purpose": "pricing",
      "notes": "2026-10-24 核对当前来源；Token Plan 与 M Plan 独立记录。"
    },
    {
      "id": "audit-model-lifecycle",
      "url": "https://platform.minimax.cn/docs/faq/models",
      "purpose": "models",
      "notes": "2026-10-24 核对当前来源；Token Plan 与 M Plan 独立记录。"
    },
    {
      "id": "audit-token-legacy",
      "url": "https://platform.minimax.cn/docs/m-plan/token-plan-notice",
      "purpose": "subscription",
      "notes": "2026-10-24 核对当前来源；Token Plan 与 M Plan 独立记录。"
    },
    {
      "id": "m-plan-cn",
      "url": "https://platform.minimax.cn/docs/m-plan/intro",
      "purpose": "subscription",
      "notes": "2026-10-24 核对当前来源；Token Plan 与 M Plan 独立记录。"
    },
    {
      "id": "m-plan-quickstart",
      "url": "https://platform.minimax.cn/docs/m-plan/quickstart",
      "purpose": "models",
      "notes": "2026-10-24 核对当前来源；Token Plan 与 M Plan 独立记录。"
    }
  ],
  "notes": "官方入口与本次核对来源；逐模型、价格、套餐的确认结论见 verification 和 evidence。"
}
