{
  "schema_version": 1,
  "id": "zhipu",
  "display_name": "智谱 BigModel",
  "sources": [
    {
      "id": "catalog",
      "url": "https://open.bigmodel.cn/pricing",
      "purpose": "models",
      "notes": "旧目录登记入口；本次迁入不代表已重新验证。"
    },
    {
      "id": "coding-plan-cn",
      "url": "https://docs.bigmodel.cn/cn/coding-plan/overview",
      "purpose": "subscription",
      "notes": "旧目录登记入口；本次迁入不代表已重新验证。"
    },
    {
      "id": "pricing",
      "url": "https://open.bigmodel.cn/pricing",
      "purpose": "pricing",
      "notes": "国内 BigModel 与国际 Z.ai 不混价；GLM Coding Plan 独立，价格页可能需浏览器渲染。"
    },
    {
      "id": "audit-full-prices",
      "url": "https://docs.bigmodel.cn/cn/guide/start/pricing.md",
      "purpose": "billing",
      "notes": "2026-09-16 全量核对使用的官方来源；结论见本次 evidence。"
    },
    {
      "id": "audit-models-current",
      "url": "https://docs.bigmodel.cn/cn/guide/start/model-overview.md",
      "purpose": "billing",
      "notes": "2026-09-16 全量核对使用的官方来源；结论见本次 evidence。"
    },
    {
      "id": "audit-coding-plan-cn",
      "url": "https://docs.bigmodel.cn/cn/coding-plan/overview",
      "purpose": "billing",
      "notes": "2026-09-16 全量核对使用的官方来源；结论见本次 evidence。"
    },
    {
      "id": "alignment-zhipu-full-prices",
      "url": "https://docs.bigmodel.cn/cn/guide/start/pricing.md",
      "purpose": "pricing",
      "notes": "参考价对齐来源；同平台按量价。"
    },
    {
      "id": "protocol-chat",
      "url": "https://docs.bigmodel.cn/api-reference/模型-api/对话补全",
      "purpose": "models",
      "notes": "2026-09-16 协议面专项核对；具体型号范围、产品身份和缺项见本地协议证据。"
    },
    {
      "id": "protocol-messages",
      "url": "https://docs.bigmodel.cn/cn/guide/develop/claude/introduction",
      "purpose": "models",
      "notes": "2026-09-16 协议面专项核对；具体型号范围、产品身份和缺项见本地协议证据。"
    },
    {
      "id": "protocol-coding",
      "url": "https://docs.bigmodel.cn/cn/guide/develop/others",
      "purpose": "models",
      "notes": "2026-09-16 协议面专项核对；具体型号范围、产品身份和缺项见本地协议证据。"
    },
    {
      "id": "protocol-codex",
      "url": "https://docs.bigmodel.cn/cn/coding-plan/tool/codex",
      "purpose": "models",
      "notes": "2026-09-16 协议面专项核对；具体型号范围、产品身份和缺项见本地协议证据。"
    },
    {
      "id": "reasoning-zhipu",
      "url": "https://docs.bigmodel.cn/cn/guide/capabilities/thinking",
      "purpose": "models",
      "notes": "思考能力专项；来源小节、型号适用范围与缺项见本地证据。"
    },
    {
      "id": "context-zhipu-models",
      "url": "https://docs.bigmodel.cn/cn/guide/start/model-overview.md",
      "purpose": "models",
      "notes": "上下文长度专项来源；位置、UTC 获取时间、整数 / 标称规格和缺项见本地 context 证据。"
    },
    {
      "id": "context-zhipu-latest",
      "url": "https://docs.bigmodel.cn/cn/coding-plan/latest-model.md",
      "purpose": "models",
      "notes": "上下文长度专项来源；位置、UTC 获取时间、整数 / 标称规格和缺项见本地 context 证据。"
    },
    {
      "id": "audit-20261024-flash",
      "url": "https://docs.bigmodel.cn/cn/guide/models/vlm/glm-5.3-flash.md",
      "purpose": "models",
      "notes": "2026-10-24 核对来源；具体型号、产品与缺口见本轮证据。"
    },
    {
      "id": "audit-20261024-chat",
      "url": "https://docs.bigmodel.cn/api-reference/%E6%A8%A1%E5%9E%8B-api/%E5%AF%B9%E8%AF%9D%E8%A1%A5%E5%85%A8.md",
      "purpose": "models",
      "notes": "2026-10-24 核对来源；具体型号、产品与缺口见本轮证据。"
    }
  ],
  "notes": "官方入口与本次核对来源；逐模型、价格、套餐的确认结论见 verification 和 evidence。"
}
