{
  "schema_version": 1,
  "id": "hunyuan",
  "display_name": "腾讯 TokenHub / 混元",
  "sources": [
    {
      "id": "catalog",
      "url": "https://cloud.tencent.com/document/product/1823/130051",
      "purpose": "models",
      "notes": "旧目录登记入口；本次迁入不代表已重新验证。"
    },
    {
      "id": "pricing",
      "url": "https://cloud.tencent.com/document/product/1823/130051",
      "purpose": "pricing",
      "notes": "旧混元与 TokenHub 的迁移不等于价格继承；国内与国际服务范围独立核对。"
    },
    {
      "id": "audit-prices",
      "url": "https://cloud.tencent.com/document/product/1823/130055",
      "purpose": "billing",
      "notes": "2026-09-16 全量核对使用的官方来源；结论见本次 evidence。"
    },
    {
      "id": "protocol-language",
      "url": "https://cloud.tencent.com/document/product/1823/130079",
      "purpose": "models",
      "notes": "2026-09-16 协议面专项核对；具体型号范围、产品身份和缺项见本地协议证据。"
    },
    {
      "id": "protocol-hy",
      "url": "https://cloud.tencent.com/document/product/1823/132252",
      "purpose": "models",
      "notes": "2026-09-16 协议面专项核对；具体型号范围、产品身份和缺项见本地协议证据。"
    },
    {
      "id": "protocol-api",
      "url": "https://cloud.tencent.com/document/product/1823/130078",
      "purpose": "models",
      "notes": "2026-09-16 协议面专项核对；具体型号范围、产品身份和缺项见本地协议证据。"
    },
    {
      "id": "reasoning-hunyuan-guide",
      "url": "https://cloud.tencent.com/document/product/1823/132252",
      "purpose": "models",
      "notes": "思考能力专项；来源小节、型号适用范围与缺项见本地证据。"
    },
    {
      "id": "context-hunyuan-list",
      "url": "https://cloud.tencent.com/document/product/1823/130051",
      "purpose": "models",
      "notes": "上下文长度专项来源；位置、UTC 获取时间、整数 / 标称规格和缺项见本地 context 证据。"
    },
    {
      "id": "audit-20261024-thinking",
      "url": "https://cloud.tencent.com/document/product/1823/131208",
      "purpose": "models",
      "notes": "2026-10-24 核对来源；具体型号、产品与缺口见本轮证据。"
    }
  ],
  "notes": "官方入口与本次核对来源；逐模型、价格、套餐的确认结论见 verification 和 evidence。"
}
