{
  "schema_version": 1,
  "id": "deepseek",
  "display_name": "DeepSeek",
  "sources": [
    {
      "id": "catalog",
      "url": "https://api-docs.deepseek.com/zh-cn/quick_start/pricing",
      "purpose": "models",
      "notes": "旧目录登记入口；本次迁入不代表已重新验证。"
    },
    {
      "id": "pricing",
      "url": "https://api-docs.deepseek.com/zh-cn/quick_start/pricing/",
      "purpose": "pricing",
      "notes": "缓存命中与未命中分别定价；核对峰谷作息、币种以及旧模型名的实际映射。"
    },
    {
      "id": "audit-pricing",
      "url": "https://api-docs.deepseek.com/zh-cn/quick_start/pricing/",
      "purpose": "billing",
      "notes": "2026-09-16 全量核对使用的官方来源；结论见本次 evidence。"
    },
    {
      "id": "protocol-chat",
      "url": "https://api-docs.deepseek.com/quick_start/pricing/",
      "purpose": "models",
      "notes": "2026-09-16 协议面专项核对；具体型号范围、产品身份和缺项见本地协议证据。"
    },
    {
      "id": "protocol-responses",
      "url": "https://api-docs.deepseek.com/api/create-response/",
      "purpose": "models",
      "notes": "2026-09-16 协议面专项核对；具体型号范围、产品身份和缺项见本地协议证据。"
    },
    {
      "id": "protocol-messages",
      "url": "https://api-docs.deepseek.com/guides/anthropic_api/",
      "purpose": "models",
      "notes": "2026-09-16 协议面专项核对；具体型号范围、产品身份和缺项见本地协议证据。"
    },
    {
      "id": "reasoning-deepseek",
      "url": "https://api-docs.deepseek.com/guides/thinking_mode/",
      "purpose": "models",
      "notes": "思考能力专项；来源小节、型号适用范围与缺项见本地证据。"
    },
    {
      "id": "context-deepseek-models",
      "url": "https://api-docs.deepseek.com/quick_start/pricing",
      "purpose": "models",
      "notes": "上下文长度专项来源；位置、UTC 获取时间、整数 / 标称规格和缺项见本地 context 证据。"
    }
  ],
  "notes": "官方入口与本次核对来源；逐模型、价格、套餐的确认结论见 verification 和 evidence。",
  "excluded_request_ids": [
    "deepseek-v4-flash",
    "deepseek-v4-flash-vision-exp"
  ]
}
