{
  "schema_version": 1,
  "id": "siliconflow",
  "display_name": "硅基流动",
  "sources": [
    {
      "id": "catalog",
      "url": "https://siliconflow.cn/models",
      "purpose": "models",
      "notes": "旧目录登记入口；本次迁入不代表已重新验证。"
    },
    {
      "id": "pricing",
      "url": "https://siliconflow.cn/pricing",
      "purpose": "pricing",
      "notes": "国内 / 国际站分别定价；平台提供的第三方模型不能引用训练方价格。"
    },
    {
      "id": "tts-metering",
      "url": "https://api-docs.siliconflow.cn/docs/userguide/capabilities/text-to-speech",
      "purpose": "pricing",
      "notes": "国内 TTS UTF-8 字节计量说明；仍需逐模型查单价和适用口径。"
    },
    {
      "id": "audit-pricing",
      "url": "https://siliconflow.cn/pricing",
      "purpose": "billing",
      "notes": "2026-09-16 全量核对使用的官方来源；结论见本次 evidence。"
    },
    {
      "id": "audit-changes",
      "url": "https://docs.siliconflow.cn/docs/release-notes/overview",
      "purpose": "billing",
      "notes": "2026-09-16 全量核对使用的官方来源；结论见本次 evidence。"
    }
  ],
  "notes": "官方入口与本次核对来源；逐模型、价格、套餐的确认结论见 verification 和 evidence。",
  "excluded_request_ids": [
    "Qwen/Qwen3.5-397B-A17B",
    "MiniMaxAI/MiniMax-M2.5",
    "Pro/zai-org/GLM-4.7"
  ]
}
